输入,输出,逻辑
受伤,冰块,用冰块冷敷可以缓解受伤部位的肿胀  
冰块,思维,冰块的冰冷可以让人清醒，从而活跃思维  
思维,蚂蚁,蚂蚁具有群体思维和高度组织性  
蚂蚁,极限,蚂蚁虽小却能举起超过自身体重的极限物体  
极限,麻雀,麻雀虽小但也能飞翔至极限高度  
麻雀,鳎目鱼,麻雀是陆地上的小鸟，鳎目鱼是海里的“扁平”生物，两者在形态上形成对比  
鳎目鱼,青椒,青椒是一种常见的调味食材，鳎目鱼可作为菜肴，二者同属饮食范畴  
青椒,隐喻,青椒的辛辣味常被用来隐喻某种刺激或挑战  
隐喻,陶罐,陶罐是古老容器，常用于文学作品中作隐喻使用  
陶罐,迷宫,陶罐形状类似某些迷宫结构，也可象征未知与探索  
迷宫,解构,走出迷宫需要对结构进行分析和解构  
解构,自由,解构传统束缚后，人可能获得思想或行为上的自由  
自由,网络,网络既是自由表达的平台，也是信息牢笼  
网络,空调,空调通过网络连接实现智能控制，体现现代科技融合  
空调,砂纸,两者都是通过调节达到“平衡”：空调调节温度，砂纸调节表面光滑度  
砂纸,直觉,打磨时依靠手感（直觉）判断是否平整  
直觉,电梯,进入电梯时往往凭直觉选择站立位置  
电梯,爵士乐,电梯中播放的背景音乐常见轻松的爵士乐  
爵士乐,熵增,爵士乐看似无序实则有序，类比于熵增系统中的局部有序  
熵增,瀑布,瀑布水流从高处流向低处，符合热力学熵增原理  
瀑布,显微镜,瀑布由无数水滴组成，显微镜下可见微观世界  
显微镜,无限,显微镜揭示微观世界的无限可能  
无限,拓扑,拓扑学研究空间、连续性和无限可能性  
拓扑,手机,手机信号传输涉及拓扑结构的网络布局  
手机,悖论,手机带来沟通便利的同时也造成人际疏离，形成一种技术悖论  
悖论,快递,快递本为加速传递，有时反而因延迟成为慢递  
快递,彳亍,收快递前焦急等待，心情如同彳亍徘徊  
彳亍,异化,人在社会中逐渐异化，如行走般失去初衷  
异化,幽默感,幽默感是对抗异化的一种方式  
幽默感,崇高,幽默感有时以轻松形式表现崇高的智慧  
崇高,密码,崇高理念常以密码形式深藏于文化之中  
密码,宿命,密码往往决定命运走向，宿命亦然  
宿命,存在,宿命论探讨人的存在是否已被注定  
存在,向日葵,向日葵朝向太阳生长，象征生命的存在意志  
向日葵,思维,向日葵象征阳光与希望，激发积极思维